Name,Description,State,Priority,Labels,Start Date,Target Date,Estimate,Module,Cycle
"Corrigir title default 'Create Next App' em app/layout.tsx","Metadata ainda mostra o titulo padrao do create-next-app no head. Trocar para 'Parrilla 8187 — Reservas' ou equivalente, ajustar tambem a description.",Todo,Urgent,"priority:p0,type:debt,area:public",2026-04-21,2026-04-21,0.25,Seguranca & Saneamento,Sprint 1 - Saneamento de seguranca
"Log de eventos suspeitos (muitas reservas do mesmo IP)","Adicionar log estruturado quando detectar >5 reservas em 10min do mesmo IP. Guardar em tabela audit_log ou enviar para servico externo.",Backlog,Medium,"priority:p2,type:security,area:admin",2026-05-25,2026-05-30,2,Seguranca & Saneamento,Sprint 6 - Anti-abuso
"Trocar senha provisoria do admin@parrilla8187.com.br","Antes de entregar credenciais ao cliente, trocar a senha 'Parrilla8187!' por uma gerada aleatoriamente. Enviar via canal seguro (vault/1Password).",Todo,Urgent,"priority:p0,type:security,area:admin",2026-04-21,2026-04-21,0.25,Autenticacao & Multi-tenancy,Sprint 2 - Admin operavel
"Fluxo 'esqueci minha senha' para admin","Tela + server action usando supabase.auth.resetPasswordForEmail. Enviar email com magic link.",Backlog,Medium,"priority:p2,type:feature,area:admin",2026-05-18,2026-05-23,2,Autenticacao & Multi-tenancy,Sprint 5 - Configuracoes editaveis
"Ativar resolver de tenant dinamico no frontend","Hoje o tenant 'parrilla8187' esta hardcoded em app/reservar/actions.ts. Trocar por resolver via subdomain ou path-prefix (/r/{slug}/...).",Backlog,Low,"priority:p3,type:feature,area:public",2026-05-18,2026-05-23,3,Autenticacao & Multi-tenancy,Sprint 5 - Configuracoes editaveis
"Documentar onboarding de novo tenant","Passo-a-passo: criar tenant no banco, criar establishment, criar business_hours, criar usuario admin, criar tenant_membership.",Backlog,Low,"priority:p3,type:docs,area:admin",2026-05-18,2026-05-23,1,Autenticacao & Multi-tenancy,Sprint 5 - Configuracoes editaveis
"Edicao de configuracoes do tenant (nome, cor, logo)","Form em /admin/configuracoes para editar tenants.name/brand_color/logo_url. Server action com update protegido por role>=manager.",Backlog,Medium,"priority:p2,type:feature,area:admin",2026-05-18,2026-05-23,2,Painel Admin,Sprint 5 - Configuracoes editaveis
"Gerenciar business_hours no admin","UI para abrir/fechar por dia da semana e ajustar slot_duration_minutes. Update direto na tabela business_hours.",Backlog,Medium,"priority:p2,type:feature,area:admin",2026-05-18,2026-05-23,3,Painel Admin,Sprint 5 - Configuracoes editaveis
"Criar slot_blocks manualmente no admin","Permitir bloquear datas/horarios (ex: 'fechado 25/12', 'evento privado dia 10/05'). Insert em slot_blocks.",Backlog,Medium,"priority:p2,type:feature,area:admin",2026-05-18,2026-05-23,2,Painel Admin,Sprint 5 - Configuracoes editaveis
"Adicionar Cloudflare Turnstile (captcha) no form de reserva","Instalar @marsidev/react-turnstile, gerar site key, validar token server-side na createReservationAction.",Backlog,High,"priority:p1,type:security,area:public",2026-05-25,2026-05-30,2,Fluxo Publico de Reserva,Sprint 6 - Anti-abuso
"Limite de 3 reservas futuras ativas por numero de WhatsApp","Antes de inserir, contar reservations do mesmo guest_contact com slot_start>=now e status!=cancelled. Rejeitar se >=3.",Backlog,Medium,"priority:p2,type:security,area:public",2026-05-25,2026-05-30,1,Fluxo Publico de Reserva,Sprint 6 - Anti-abuso
"Validacao mais robusta de formato de WhatsApp","Hoje aceita qualquer string. Validar que tem >=10 digitos apos sanitize, e prefixo 55 implicito.",Backlog,Low,"priority:p3,type:feature,area:public",2026-05-25,2026-05-30,1,Fluxo Publico de Reserva,Sprint 6 - Anti-abuso
"Tabela beto_conversations para persistir historico","Schema: id uuid, session_id text, messages jsonb, tenant_id uuid, created_at, updated_at. RLS tenant-scoped.",Backlog,Medium,"priority:p2,type:feature,area:public",2026-05-02,2026-05-09,4,Atendente IA (Beto),Sprint 3 - Chat persistente
"UI: indicador 'continuar de onde parou' no BetoChat","Ao abrir o chat, se ha conversa anterior no cookie de sessao, carregar e mostrar badge 'retomando conversa'.",Backlog,Medium,"priority:p2,type:feature,area:public",2026-05-02,2026-05-09,2,Atendente IA (Beto),Sprint 3 - Chat persistente
"Rate limiting no /api/beto/chat (30 msg/h por sessao)","Reutilizar lib/rate-limit.ts com key = session_id. Limite 30/hora. Retornar 429 + header Retry-After.",Backlog,High,"priority:p1,type:security,area:public",2026-05-02,2026-05-09,1,Atendente IA (Beto),Sprint 3 - Chat persistente
"Migrar cardapio hardcoded para tabelas do Supabase","Criar tabelas menu_categories e menu_items. Mover dados de app/lib/beto/menu.ts para seed SQL. Regenerar system prompt dinamicamente.",Backlog,Low,"priority:p3,type:debt,area:admin",2026-05-25,2026-05-30,8,Atendente IA (Beto),Sprint 6 - Anti-abuso
"Migrar getAvailability() para PL/pgSQL","Function SQL get_availability(establishment_id, date) retornando slots livres em uma query atomica. Substituir as 3 queries atuais em app/lib/availability.ts.",Backlog,Medium,"priority:p2,type:debt,area:infra",2026-05-10,2026-05-16,3,Disponibilidade & Slots,Sprint 4 - Disponibilidade robusta
"Cache HTTP de 60s na API de slots","Adicionar headers Cache-Control: public, max-age=60 em /api/reservar/slots. Reduz carga no banco para datas populares.",Backlog,Low,"priority:p3,type:feature,area:infra",2026-05-10,2026-05-16,0.5,Disponibilidade & Slots,Sprint 4 - Disponibilidade robusta
"Backup automatico diario do banco Supabase","Cron job que usa supabase db dump --project-ref para salvar snapshot em storage proprio (S3 ou local). Reter 30 dias.",Backlog,High,"priority:p1,type:feature,area:infra",2026-04-21,2026-04-30,2,Infraestrutura & DevOps,Sprint 1 - Saneamento de seguranca
"Monitoring de uptime com alerta Slack/Telegram","Healthcheck externo (UptimeRobot ou self-hosted Uptime Kuma) batendo em /reservar a cada 1min. Alerta se status!=200 por 3 ciclos.",Backlog,High,"priority:p1,type:feature,area:infra",2026-04-21,2026-04-30,3,Infraestrutura & DevOps,Sprint 1 - Saneamento de seguranca
"Pipeline CI/CD (git push na master deploy automatico)","GitHub Actions: build docker image push para registry local docker service update. Dispara em push na master.",Backlog,Medium,"priority:p2,type:feature,area:infra",2026-05-10,2026-05-16,4,Infraestrutura & DevOps,Sprint 4 - Disponibilidade robusta
"Documentar comando de rollback emergencial","Runbook curto: como voltar para imagem anterior em caso de deploy ruim. Incluir no README ou em docs/runbook.md.",Backlog,Low,"priority:p3,type:docs,area:infra",2026-04-21,2026-04-30,0.5,Infraestrutura & DevOps,Sprint 1 - Saneamento de seguranca
